{
  "name": "infrastructure-devops",
  "description": "Infrastructure and DevOps agent for Terraform, Docker, Kubernetes, and Tilt orchestration. Manages local dev environments, deployment pipelines, nginx gateway configuration, and security hardening. Has shell access for infrastructure commands but write scope is limited to infra-related files only. Requires approval for database mutations and destructive operations.",
  "prompt": "You are an infrastructure and DevOps assistant specializing in Terraform, Docker, Kubernetes, and deployment pipelines. You manage local development orchestration with Tilt, configure nginx gateways, write multi-stage Dockerfiles, create Kubernetes manifests, and maintain Terraform modules. You enforce security policies including OAuth2, CORS, secrets management, and container hardening. Always run terraform plan before apply. Never commit secrets or .env files.",
  "mcpServers": {
    "git": {
      "command": "npx",
      "args": ["tsx", "/home/ryanm/workspace/ai/mcp/mcp-scripts/servers/git.ts"],
      "timeout": 30000
    },
    "io": {
      "command": "npx",
      "args": ["tsx", "/home/ryanm/workspace/ai/mcp/mcp-scripts/servers/io.ts"],
      "timeout": 10000
    },
    "postgres": {
      "command": "npx",
      "args": ["tsx", "/home/ryanm/workspace/ai/mcp/mcp-scripts/servers/postgres.ts"],
      "timeout": 30000
    }
  },
  "tools": [
    "read",
    "write",
    "shell",
    "glob",
    "grep",
    "@git",
    "@io",
    "@postgres"
  ],
  "allowedTools": [
    "read",
    "write",
    "glob",
    "grep",
    "@git/git_status",
    "@io/read_json",
    "@postgres/postgres_query"
  ],
  "toolsSettings": {
    "write": {
      "allowedPaths": [
        "terraform/**",
        "docker/**",
        "k8s/**",
        "Tiltfile",
        "*.yaml",
        "*.yml",
        "*.tf",
        "*.tfvars",
        "*.hcl",
        "Dockerfile*",
        "*.conf",
        "*.sh",
        "*.md",
        ".github/**"
      ]
    },
    "shell": {
      "allowedCommands": [
        "tilt *",
        "docker *",
        "docker-compose *",
        "kubectl *",
        "helm *",
        "terraform *",
        "git *",
        "aws *",
        "curl *",
        "cat *",
        "ls *",
        "find *",
        "grep *"
      ]
    }
  },
  "resources": [
    "skill://../skills/git-workflow.md",
    "skill://../skills/general-deploy.md",
    "skill://../skills/backend-rest-api-feature.md",
    "skill://../skills/backend-cron-feature.md",
    "skill://../skills/general-debug.md",
    "file://Tiltfile",
    "file://docker-compose*.yml",
    "file://k8s/*.yaml",
    "file://../steering/orchestration/local-dev.md",
    "file://../steering/security/policies.md"
  ],
  "hooks": {
    "agentSpawn": [
      {
        "command": "git status --porcelain",
        "timeout_ms": 5000
      },
      {
        "command": "git branch --show-current",
        "timeout_ms": 3000
      },
      {
        "command": "kubectl config current-context 2>/dev/null || echo 'no k8s context'",
        "timeout_ms": 5000
      },
      {
        "command": "docker ps --format 'table {{.Names}}\t{{.Status}}' 2>/dev/null | head -10 || echo 'docker not running'",
        "timeout_ms": 5000
      }
    ]
  }
}
